{
  "case_id": "explicit-p4-repairable-s102",
  "family": "explicit_controlled",
  "instance_digest": "sha256:d8b02694f0f7a28588dd010359865958a42c34ef8e87267524884023602ca52e",
  "protocol_sha256": "d7e0a1351722e8bc41a9ac64617b455bad30125c016ed52916c95804ba065aaa",
  "result": {
    "budget": "3/25",
    "challenger_ids": [
      "core2",
      "core0",
      "core1",
      "core3"
    ],
    "master_certificate": {
      "active_rows": [
        0,
        1,
        2,
        3,
        9
      ],
      "equality_multipliers": [
        "-1/25"
      ],
      "inequality_multipliers": [
        "1/5",
        "6/25",
        "7/25",
        "7/25",
        "1/3"
      ],
      "objective": "0",
      "point": [
        "6/25",
        "7/25",
        "1/5",
        "7/25",
        "3/25",
        "0"
      ],
      "status": "OPTIMAL"
    },
    "oracle_calls": 5,
    "oracle_proofs": [
      {
        "challengers_checked": 8,
        "minimum": "-1/20",
        "type": "explicit_enumeration"
      },
      {
        "challengers_checked": 8,
        "minimum": "-19/150",
        "type": "explicit_enumeration"
      },
      {
        "challengers_checked": 8,
        "minimum": "-18/175",
        "type": "explicit_enumeration"
      },
      {
        "challengers_checked": 8,
        "minimum": "-18/175",
        "type": "explicit_enumeration"
      },
      {
        "challengers_checked": 8,
        "minimum": "0",
        "type": "explicit_enumeration"
      }
    ],
    "parameters": {
      "budget": "3/25",
      "multipliers": [
        "3/25"
      ],
      "weights": [
        "6/25",
        "7/25",
        "1/5",
        "7/25"
      ]
    },
    "retained_rows": 4,
    "value": "0"
  },
  "schema": "mmor-profile-record-1.0"
}
