{
  "case_id": "assignment-n6-p2-s9",
  "family": "assignment",
  "instance_digest": "sha256:1170b0bb3f9b60e4c04b550b7f534736b8c430d1a81edf8ab0746cdf6d81babb",
  "protocol_sha256": "d7e0a1351722e8bc41a9ac64617b455bad30125c016ed52916c95804ba065aaa",
  "result": {
    "budget": "1",
    "challenger_ids": [
      "perm:2,1,3,0,5,4",
      "perm:1,3,5,0,4,2",
      "perm:5,2,3,1,4,0",
      "perm:5,2,3,0,4,1",
      "perm:2,1,3,0,4,5"
    ],
    "master_certificate": {
      "active_rows": [
        1,
        3,
        4
      ],
      "equality_multipliers": [
        "118257/1144798"
      ],
      "inequality_multipliers": [
        "233000/572399",
        "316503/572399",
        "22896/572399"
      ],
      "objective": "118257/1144798",
      "point": [
        "450338/572399",
        "122061/572399",
        "72684/572399",
        "118257/1144798"
      ],
      "status": "OPTIMAL"
    },
    "oracle_calls": 6,
    "oracle_proofs": [
      {
        "candidate_excluded": true,
        "column_potentials": [
          -1005,
          0,
          -2098,
          -257,
          -4969,
          -2963
        ],
        "constraints": [
          -9
        ],
        "excluded_subproblems": [],
        "integer_scale": 46284,
        "minimum_score": "-374/11571",
        "objective": [
          203,
          128
        ],
        "row_potentials": [
          13031,
          7148,
          697,
          6326,
          9272,
          9503
        ],
        "selected_forbidden_row": -1,
        "type": "assignment_integer_hungarian_dual"
      },
      {
        "candidate_excluded": true,
        "column_potentials": [
          0,
          0,
          -21,
          -1,
          0,
          0
        ],
        "constraints": [
          -9
        ],
        "excluded_subproblems": [
          {
            "forbidden_row": 0,
            "optimum": 133
          },
          {
            "forbidden_row": 1,
            "optimum": 133
          },
          {
            "forbidden_row": 2,
            "optimum": 133
          },
          {
            "forbidden_row": 3,
            "optimum": 149
          },
          {
            "forbidden_row": 4,
            "optimum": 176
          },
          {
            "forbidden_row": 5,
            "optimum": 156
          }
        ],
        "integer_scale": 266,
        "minimum_score": "3/266",
        "objective": [
          133,
          277
        ],
        "row_potentials": [
          58,
          16,
          3,
          26,
          25,
          27
        ],
        "selected_forbidden_row": 0,
        "type": "assignment_integer_hungarian_dual"
      },
      {
        "candidate_excluded": true,
        "column_potentials": [
          -3075,
          0,
          -5856,
          -6332,
          -4026,
          -1353
        ],
        "constraints": [
          57
        ],
        "excluded_subproblems": [
          {
            "forbidden_row": 0,
            "optimum": 39038
          },
          {
            "forbidden_row": 1,
            "optimum": 35354
          },
          {
            "forbidden_row": 2,
            "optimum": 38362
          },
          {
            "forbidden_row": 3,
            "optimum": 35354
          },
          {
            "forbidden_row": 4,
            "optimum": 37354
          },
          {
            "forbidden_row": 5,
            "optimum": 35354
          }
        ],
        "integer_scale": 51814,
        "minimum_score": "1447/25907",
        "objective": [
          156,
          173
        ],
        "row_potentials": [
          9129,
          11507,
          6770,
          8559,
          8871,
          11160
        ],
        "selected_forbidden_row": 1,
        "type": "assignment_integer_hungarian_dual"
      },
      {
        "candidate_excluded": true,
        "column_potentials": [
          -183704,
          0,
          -452016,
          -460314,
          -327383,
          -201054
        ],
        "constraints": [
          8
        ],
        "excluded_subproblems": [
          {
            "forbidden_row": 0,
            "optimum": 2803835
          },
          {
            "forbidden_row": 1,
            "optimum": 2753360
          },
          {
            "forbidden_row": 2,
            "optimum": 2851691
          },
          {
            "forbidden_row": 3,
            "optimum": 2853519
          },
          {
            "forbidden_row": 4,
            "optimum": 2792869
          },
          {
            "forbidden_row": 5,
            "optimum": 2753360
          }
        ],
        "integer_scale": 3419724,
        "minimum_score": "155233/1709862",
        "objective": [
          173,
          156
        ],
        "row_potentials": [
          783624,
          894336,
          597106,
          572619,
          701095,
          829051
        ],
        "selected_forbidden_row": 1,
        "type": "assignment_integer_hungarian_dual"
      },
      {
        "candidate_excluded": true,
        "column_potentials": [
          -5991,
          -3244,
          -71237,
          -11490,
          -37617,
          0
        ],
        "constraints": [
          -19
        ],
        "excluded_subproblems": [
          {
            "forbidden_row": 0,
            "optimum": 811736
          },
          {
            "forbidden_row": 1,
            "optimum": 839709
          },
          {
            "forbidden_row": 2,
            "optimum": 839709
          },
          {
            "forbidden_row": 3,
            "optimum": 894344
          },
          {
            "forbidden_row": 4,
            "optimum": 839709
          },
          {
            "forbidden_row": 5,
            "optimum": 811736
          }
        ],
        "integer_scale": 880838,
        "minimum_score": "32068/440419",
        "objective": [
          192,
          149
        ],
        "row_potentials": [
          241508,
          159705,
          89216,
          116789,
          155122,
          178975
        ],
        "selected_forbidden_row": 0,
        "type": "assignment_integer_hungarian_dual"
      },
      {
        "candidate_excluded": true,
        "column_potentials": [
          0,
          0,
          -84794,
          0,
          -30112,
          -95721
        ],
        "constraints": [
          -9
        ],
        "excluded_subproblems": [
          {
            "forbidden_row": 0,
            "optimum": 978280
          },
          {
            "forbidden_row": 1,
            "optimum": 978280
          },
          {
            "forbidden_row": 2,
            "optimum": 978280
          },
          {
            "forbidden_row": 3,
            "optimum": 1043500
          },
          {
            "forbidden_row": 4,
            "optimum": 990628
          },
          {
            "forbidden_row": 5,
            "optimum": 978280
          }
        ],
        "integer_scale": 1144798,
        "minimum_score": "118257/1144798",
        "objective": [
          133,
          277
        ],
        "row_potentials": [
          297507,
          158172,
          225682,
          134438,
          165476,
          207632
        ],
        "selected_forbidden_row": 2,
        "type": "assignment_integer_hungarian_dual"
      }
    ],
    "parameters": {
      "budget": "72684/572399",
      "multipliers": [
        "72684/572399"
      ],
      "weights": [
        "450338/572399",
        "122061/572399"
      ]
    },
    "retained_rows": 5,
    "value": "118257/1144798"
  },
  "schema": "mmor-profile-record-1.0"
}
